motion_id,title_motion,text_motion,lis_id,proposal_date,classification,acceptance_number,categories,status,billenforce_id,billmerge__id,billreject_id,created_at,updated_at,organizations_bill,propser ID,proposer,voters_id,voter_party,Table - data_cleansing.parliament,Table - data_cleansing.party_side,Table - data_cleansing.creators_type
64fc303c-fe64-46fd-8a86-6e23bf0b23ae,ร่างพระราชบัญญัติวิธีการงบประมาณ (ฉบับที่..) พ.ศ. ....,"ร่าง พ.ร.บ. วิธีการงบประมาณ มีสาระสำคัญคือ ให้ยกเลิกมาตรา 45 พ.ร.บ.วิธีการงบประมาณ พ.ศ.2561 ที่บัญญัติให้ ครม.มีอำนาจจ่ายเงินทุนสำรองจ่ายจำนวน 50,000 ล้านบาท จากคลังเพื่อนำไปใช้ในกรณีที่มีความจำเป็นและเร่งด่วน ซึ่งไม่สอดคล้องกับรัฐธรรมนูญฯ พ.ศ.2560 มาตรา 141 เนื่องจากหลักการทางกฎหมายมาตรา 141 กำหนดว่า การนำงบประมาณแผ่นดินไปใช้ ต้องเสนอสภาผู้แทนราษฎร และหากมีการตั้งเงินทุนสำรองจ่ายเพิ่มอีก เป็นเสมือนการเอางบประมาณแผ่นดินไปใช้งายๆ โดยไม่มีการตรวจสอบการใช้งบประมาณแผ่นดินที่เป็นเงินภาษีของประชาชน จึงควรให้สภาผู้แทนราษฎรได้ตรวจสอบและให้ความเห็นชอบในการนำงบประมาณแผ่นดินไปใช้ และที่ผ่านมาในรัฐบาลประยุทธ์ จันทร์โอชา มีการใช้งบประมาณอย่างไม่มีประสิทธิภาพ",17,43707,NORMAL_BILL,3/2562,"[""บริหารราชการ"",""เศรษฐกิจ""]",REJECT,,,dc09f0a2-50ef-4e2e-b44e-9970791daa74,26/9/2025 15:19,24/10/2025 18:48,สภาผู้แทนราษฎร ชุดที่ 25,41c01034-c1d4-4541-9055-233f275dd82e,นาย ชวลิต วิชยสุทธิ์,41c01034-c1d4-4541-9055-233f275dd82e,เพื่อไทย,นายกรัฐมนตรี ครม. คณะที่ 62 (ประยุทธ์ จันทร์โอชา),พรรคฝ่ายค้าน,พรรคการเมือง
3ff4d0db-8ab9-4861-892e-bc2b6e536b01,พระราชบัญญัติการเดินเรือในน่านน้ำไทย (ฉบับที่ ..) พ.ศ. ....,ร่าง พ.ร.บ.การเดินเรือในน่านน้ำไทย เป็นแก้ไขเพิ่มเติม พ.ร.บ.การเดินเรือในน่านน้ำไทย เกี่ยวกับเรื่องการทิ้งขยะในทะเล เนื่องจากไทยมีนโยบายเข้าเป็นภาคีอนุสัญญาระหว่างประเทศว่าด้วยการป้องกันมลพิษจากเรือ ค.ศ. 1973 ว่าด้วยกฎข้อบังคับสำหรับป้องกันมลพิษจากขยะบนเรือ เพื่อควบคุมไม่ให้มีการทิ้งขยะจากเรือหรือแท่นที่เป็นสิ่งก่อสร้างในทะเลที่ติดอยู่กับเรือ หรือที่ลอยน้ำได้ให้เป็นไปตามข้อกำหนดและมาตรฐานที่อนุสัญญากำหนด และสอดคล้องกับอนุสัญญาสหประชาชาติว่าด้วยกฎหมายทะเล ค.ศ.1982 เกี่ยวกับการป้องกัน ลด และควบคุมมลพิษของสิ่งแวดล้อมทางทะเล ซึ่งกฎหมายไทยยังไม่ครอบคลุม จึงต้องแก้ไขกฎหมายเดิม โดยเพิ่มมาตรการตามมาตรฐานสากลและพันธกรณีของอนุสัญญาดังกล่าว,147,44530,NORMAL_BILL,27/2564,"[""คมนาคม"",""ยุติธรรม""]",ENFORCE,a37c9c08-501e-4d17-9875-4f8843afd88c,0e8d69e3-0398-4499-a8d4-b61d25f6303b,,26/9/2025 15:19,24/10/2025 18:48,สภาผู้แทนราษฎร ชุดที่ 25,,คณะรัฐมนตรี คณะที่ 62  ,,เพื่อไทย,นายกรัฐมนตรี ครม. คณะที่ 62 (ประยุทธ์ จันทร์โอชา),,คณะรัฐมนตรี
3ff4d0db-8ab9-4861-892e-bc2b6e536b01,พระราชบัญญัติการเดินเรือในน่านน้ำไทย (ฉบับที่ ..) พ.ศ. ....,ร่าง พ.ร.บ.การเดินเรือในน่านน้ำไทย เป็นแก้ไขเพิ่มเติม พ.ร.บ.การเดินเรือในน่านน้ำไทย เกี่ยวกับเรื่องการทิ้งขยะในทะเล เนื่องจากไทยมีนโยบายเข้าเป็นภาคีอนุสัญญาระหว่างประเทศว่าด้วยการป้องกันมลพิษจากเรือ ค.ศ. 1973 ว่าด้วยกฎข้อบังคับสำหรับป้องกันมลพิษจากขยะบนเรือ เพื่อควบคุมไม่ให้มีการทิ้งขยะจากเรือหรือแท่นที่เป็นสิ่งก่อสร้างในทะเลที่ติดอยู่กับเรือ หรือที่ลอยน้ำได้ให้เป็นไปตามข้อกำหนดและมาตรฐานที่อนุสัญญากำหนด และสอดคล้องกับอนุสัญญาสหประชาชาติว่าด้วยกฎหมายทะเล ค.ศ.1982 เกี่ยวกับการป้องกัน ลด และควบคุมมลพิษของสิ่งแวดล้อมทางทะเล ซึ่งกฎหมายไทยยังไม่ครอบคลุม จึงต้องแก้ไขกฎหมายเดิม โดยเพิ่มมาตรการตามมาตรฐานสากลและพันธกรณีของอนุสัญญาดังกล่าว,147,44530,NORMAL_BILL,27/2564,"[""คมนาคม"",""ยุติธรรม""]",ENFORCE,a37c9c08-501e-4d17-9875-4f8843afd88c,f68d206e-4452-453b-bf66-3533d0a24a11,,26/9/2025 15:19,24/10/2025 18:48,สภาผู้แทนราษฎร ชุดที่ 25,,คณะรัฐมนตรี คณะที่ 62  ,,เพื่อไทย,นายกรัฐมนตรี ครม. คณะที่ 62 (ประยุทธ์ จันทร์โอชา),,คณะรัฐมนตรี
3ff4d0db-8ab9-4861-892e-bc2b6e536b01,พระราชบัญญัติการเดินเรือในน่านน้ำไทย (ฉบับที่ ..) พ.ศ. ....,ร่าง พ.ร.บ.การเดินเรือในน่านน้ำไทย เป็นแก้ไขเพิ่มเติม พ.ร.บ.การเดินเรือในน่านน้ำไทย เกี่ยวกับเรื่องการทิ้งขยะในทะเล เนื่องจากไทยมีนโยบายเข้าเป็นภาคีอนุสัญญาระหว่างประเทศว่าด้วยการป้องกันมลพิษจากเรือ ค.ศ. 1973 ว่าด้วยกฎข้อบังคับสำหรับป้องกันมลพิษจากขยะบนเรือ เพื่อควบคุมไม่ให้มีการทิ้งขยะจากเรือหรือแท่นที่เป็นสิ่งก่อสร้างในทะเลที่ติดอยู่กับเรือ หรือที่ลอยน้ำได้ให้เป็นไปตามข้อกำหนดและมาตรฐานที่อนุสัญญากำหนด และสอดคล้องกับอนุสัญญาสหประชาชาติว่าด้วยกฎหมายทะเล ค.ศ.1982 เกี่ยวกับการป้องกัน ลด และควบคุมมลพิษของสิ่งแวดล้อมทางทะเล ซึ่งกฎหมายไทยยังไม่ครอบคลุม จึงต้องแก้ไขกฎหมายเดิม โดยเพิ่มมาตรการตามมาตรฐานสากลและพันธกรณีของอนุสัญญาดังกล่าว,147,44530,NORMAL_BILL,27/2564,"[""คมนาคม"",""ยุติธรรม""]",ENFORCE,a37c9c08-501e-4d17-9875-4f8843afd88c,570b7977-607e-427f-80ee-c0ce17f690af,,26/9/2025 15:19,24/10/2025 18:48,สภาผู้แทนราษฎร ชุดที่ 25,,คณะรัฐมนตรี คณะที่ 62  ,,เพื่อไทย,นายกรัฐมนตรี ครม. คณะที่ 62 (ประยุทธ์ จันทร์โอชา),,คณะรัฐมนตรี
217b0d53-644b-4f17-9615-dbf1b54280a5,ร่างพระราชบัญญัติยกเลิกประกาศคณะรักษาความสงบแห่งชาติและคำสั่งหัวหน้าคณะรักษาความสงบแห่งชาติ พ.ศ. ....,หลังจากการรัฐประหาร 22 พฤษภาคม พ.ศ. 2557 คสช. โดยพลเอกประยุทธ์ ได้อ้างใช้อำนาจพิเศษจากมาตรา 44 แม้จะหมดสถานะคำสั่ง ประกาศต่างๆยังได้รับรองโดยมาตรา 279 ของรัฐธรรมนูญปี พ.ศ. 2560 ให้มีผลบังคับใช้ต่อไป จนกว่าจะมีการยกเลิกหรือแก้ไข และหลายฉบับมีเนื้อหาจำกัดสิทธิประชาชน กระทบสิทธิในกระบวนการยุติธรรม จำกัดเสรีภาพสื่อมวลชน ละเมิดสิทธิชุมชนและสิ่งแวดล้อม,18,43714,NORMAL_BILL,3/2562,"[""บริหารราชการ"",""สิทธิมนุษยชน""]",REJECT,,,f61b2380-9150-4e68-a7c4-24861377cfb4,26/9/2025 15:19,24/10/2025 18:48,สภาผู้แทนราษฎร ชุดที่ 25,bdf7360f-3918-449a-8451-11372614a6cd,ดร. ปิยบุตร แสงกนกกุล,bdf7360f-3918-449a-8451-11372614a6cd,พรรคอนาคตใหม่,นายกรัฐมนตรี ครม. คณะที่ 62 (ประยุทธ์ จันทร์โอชา),พรรคฝ่ายค้าน,พรรคการเมือง
c3325336-c0c3-48cd-a45b-eeb896045819,ร่างพระราชบัญญัติแก้ไขเพิ่มเติมพระราชกำหนดการประมง พ.ศ. ๒๕๕๘ พ.ศ. ....,"แก้ไขเพิ่มเติมพระราชกำหนดการประมง พ.ศ. ๒๕๕๘ ซึ่งแก้ไขเพิ่มเติมโดยพระราชกำหนด
การประมง (ฉบับที่ ๒) พ.ศ. ๒๕๖๐ โดยแก้ไขเพิ่มเติมมาตรา ๕ มาตรา ๑๖ มาตรา ๒๖ มาตรา ๓๔ มาตรา ๓๙ มาตรา ๘๑ (๑) มาตรา ๘๗ วรรคหนึ่ง มาตรา ๑๑๔ (๔) มาตรา ๑๒๔
วรรคหนึ่ง มาตรา ๑๒๕/๑ มาตรา ๑๒๗ มาตรา ๑๓๐ มาตรา ๑๓๒ มาตรา ๑๕๑ มาตรา ๑๕๒
มาตรา ๑๕๓ และมาตรา ๑๖๙ วรรคหนึ่ง",299,44720,NORMAL_BILL,29/2565,"[""สิ่งแวดล้อม"",""เศรษฐกิจ""]",REJECT,,,75739b2b-2154-4052-b8cf-6fc22a49d8ae,26/9/2025 15:19,24/10/2025 18:48,สภาผู้แทนราษฎร ชุดที่ 25,f1ba25da-9e84-4b53-8f2a-bdc719b3440b,พันตำรวจเอก ทวี สอดส่อง,f1ba25da-9e84-4b53-8f2a-bdc719b3440b,ประชาชาติ,นายกรัฐมนตรี ครม. คณะที่ 62 (ประยุทธ์ จันทร์โอชา),พรรคฝ่ายค้าน,พรรคการเมือง
feaece3d-51b7-405c-b088-d95d0f1af2b9,ร่างพระราชบัญญัติควบคุมเครื่องดื่มแอลกอฮอล์ (ฉบับที่ ..) พ.ศ. ....,"โดยที่พระราชบัญญัติควบคุมเครื่องดื่มแอลกอฮอล์ พ.ศ. ๒๕๕๑ ใช้บังคับมาเป็นเวลานาน
จึงมีบทบัญญัติบางประการที่ไม่เหมาะสมกับสภาพการณ์ที่เปลี่ยนแปลงไป และยังมีบทบัญญัติบางประการ
ที่ไม่เป็นไปตามมาตรฐานสากล มีการจำกัดสิทธิและเสรีภาพของบุคคลเกินสมควรแก่เหตุหลายประการ
ทำให้บุคคลไม่สามารถประกอบอาชีพสุจริตตามกฎหมายได้อย่างอิสระ จึงเป็นหลักเกณฑ์ที่ไม่คุ้มครอง
บุคคลให้มีเสรีภาพในการประกอบอาชีพอย่างเหมาะสมเพียงพอตามมาตรา ๔๐ ของรัฐธรรมนูญแห่งราชอาณาจักรไทย
อีกทั้งมาตรา ๗๗ ของรัฐธรรมนูญ ได้กำหนดว่ารัฐพึงจัดให้มีกฎหมายเพียงเท่าที่จำเป็นและยกเลิกกฎหมาย
ที่หมดความจำเป็นหรือไม่สอดคล้องกับสภาพการณ์ หรือที่เป็นอุปสรรคต่อการดำรงชีพหรือการประกอบอาชีพ
โดยไม่ชักช้าเพื่อไม่ให้เป็นภาระแก่ประชาชน จึงเป็นการสมควรแก้ไขเพิ่มเติมบทบัญญัติเกี่ยวกับการควบคุม
เครื่องดื่มแอลกอฮอล์ เพื่อให้การควบคุมเครื่องดื่มแอลกอฮอล์สอดคล้องกับรูปแบบการประกอบธุรกิจเกี่ยวกับ
เครื่องดื่มแอลกอฮอล์ในปัจจุบัน มีการคุ้มครองประโยชน์ของผู้บริโภคและประชาชนทั่วไปอย่างมี ประสิทธิภาพ
ตลอดจนปรับปรุงบทกำหนดโทษเพื่อให้สอดคล้องกับการแก้ไขเพิ่มเติมกฎหมายดังกล่าว",349,44271,NORMAL_BILL,29/2564,"[""สุขภาพ""]",REJECT,,,893dfaaa-a950-45c3-979b-ef74e0389296,26/9/2025 15:19,24/10/2025 18:48,สภาผู้แทนราษฎร ชุดที่ 25,,  ,,เพื่อไทย,นายกรัฐมนตรี ครม. คณะที่ 62 (ประยุทธ์ จันทร์โอชา),,
e263c1ef-4b37-4957-96cb-f865f060498b,พระราชบัญญัติว่าด้วยการวินิจฉัยชี้ขาดอำนาจหน้าที่ระหว่างศาล (ฉบับที่ ๒) พ.ศ. ๒๕๖๔,ร่าง พ.ร.บ. ชี้ขาดอำนาจหน้าที่ระหว่างศาล เป็นแก้ไขเเรื่องกรอบระยะเวลาของกระบวนการโต้แย้งเขตอำนาจศาลสำหรับการฟ้องคดีต่อศาลปกครองหรือศาลอื่นที่ไม่ใช่ศาลยุติธรรมและศาลทหาร โดยให้ยื่นคำคำร้องต่อศาลภายในกำหนดระยะเวลายื่นคำให้การหรือก่อนพ้นระยะเวลาที่ศาลอนุญาตให้ยื่นคำให้การ อีกทั้ง ยังกำหนดให้คณะกรรมการวินิจฉัยชี้ขาดอำนาจหน้าที่ระหว่างศาลต้องพิจารณาวินิจฉัยชี้ขาดอำนาจระหว่างศาลให้เสร็จภายใน 30 วัน นับตั้งแต่วันที่คณะกรรมการวินิจฉัยชี้ขาดมีมติรับเรื่อง,65,44026,NORMAL_BILL,27/2563,"[""ยุติธรรม""]",ENFORCE,35649168-34cc-43b1-b3f1-480a4690f20c,f339e52e-ee15-4ac1-b913-e62c1b7662dd,,26/9/2025 15:19,24/10/2025 18:48,สภาผู้แทนราษฎร ชุดที่ 25,,คณะรัฐมนตรี คณะที่ 62  ,,เพื่อไทย,นายกรัฐมนตรี ครม. คณะที่ 62 (ประยุทธ์ จันทร์โอชา),,คณะรัฐมนตรี
e263c1ef-4b37-4957-96cb-f865f060498b,พระราชบัญญัติว่าด้วยการวินิจฉัยชี้ขาดอำนาจหน้าที่ระหว่างศาล (ฉบับที่ ๒) พ.ศ. ๒๕๖๔,ร่าง พ.ร.บ. ชี้ขาดอำนาจหน้าที่ระหว่างศาล เป็นแก้ไขเเรื่องกรอบระยะเวลาของกระบวนการโต้แย้งเขตอำนาจศาลสำหรับการฟ้องคดีต่อศาลปกครองหรือศาลอื่นที่ไม่ใช่ศาลยุติธรรมและศาลทหาร โดยให้ยื่นคำคำร้องต่อศาลภายในกำหนดระยะเวลายื่นคำให้การหรือก่อนพ้นระยะเวลาที่ศาลอนุญาตให้ยื่นคำให้การ อีกทั้ง ยังกำหนดให้คณะกรรมการวินิจฉัยชี้ขาดอำนาจหน้าที่ระหว่างศาลต้องพิจารณาวินิจฉัยชี้ขาดอำนาจระหว่างศาลให้เสร็จภายใน 30 วัน นับตั้งแต่วันที่คณะกรรมการวินิจฉัยชี้ขาดมีมติรับเรื่อง,65,44026,NORMAL_BILL,27/2563,"[""ยุติธรรม""]",ENFORCE,35649168-34cc-43b1-b3f1-480a4690f20c,578c640e-7648-4e63-a7fd-ca19c77c076e,,26/9/2025 15:19,24/10/2025 18:48,สภาผู้แทนราษฎร ชุดที่ 25,,คณะรัฐมนตรี คณะที่ 62  ,,เพื่อไทย,นายกรัฐมนตรี ครม. คณะที่ 62 (ประยุทธ์ จันทร์โอชา),,คณะรัฐมนตรี
e263c1ef-4b37-4957-96cb-f865f060498b,พระราชบัญญัติว่าด้วยการวินิจฉัยชี้ขาดอำนาจหน้าที่ระหว่างศาล (ฉบับที่ ๒) พ.ศ. ๒๕๖๔,ร่าง พ.ร.บ. ชี้ขาดอำนาจหน้าที่ระหว่างศาล เป็นแก้ไขเเรื่องกรอบระยะเวลาของกระบวนการโต้แย้งเขตอำนาจศาลสำหรับการฟ้องคดีต่อศาลปกครองหรือศาลอื่นที่ไม่ใช่ศาลยุติธรรมและศาลทหาร โดยให้ยื่นคำคำร้องต่อศาลภายในกำหนดระยะเวลายื่นคำให้การหรือก่อนพ้นระยะเวลาที่ศาลอนุญาตให้ยื่นคำให้การ อีกทั้ง ยังกำหนดให้คณะกรรมการวินิจฉัยชี้ขาดอำนาจหน้าที่ระหว่างศาลต้องพิจารณาวินิจฉัยชี้ขาดอำนาจระหว่างศาลให้เสร็จภายใน 30 วัน นับตั้งแต่วันที่คณะกรรมการวินิจฉัยชี้ขาดมีมติรับเรื่อง,65,44026,NORMAL_BILL,27/2563,"[""ยุติธรรม""]",ENFORCE,35649168-34cc-43b1-b3f1-480a4690f20c,f01b29dd-4ed1-407f-a7d3-aab8636ae4c0,,26/9/2025 15:19,24/10/2025 18:48,สภาผู้แทนราษฎร ชุดที่ 25,,คณะรัฐมนตรี คณะที่ 62  ,,เพื่อไทย,นายกรัฐมนตรี ครม. คณะที่ 62 (ประยุทธ์ จันทร์โอชา),,คณะรัฐมนตรี
c8bafbc0-b6ae-4667-9952-029776ab8963,ร่างพระราชบัญญัติอากาศสะอาดเพื่อประชาชน พ.ศ. ....,"หลักการ
ให้มีกฎหมายว่าด้วยอากาศสะอาดเพื่อประชาชน
เหตุผลโดยสรุปคือ เนื่องจากสถานการณ์ฝุ่นควันซึ่งเป็นมลพิษทางอากาศที่ส่งผลกระทบต่อสิ่งมีชีวิตที่เกิดขึ้นในประเทศไทยติดต่อกันเป็นเวลานานโดยมีที่มาจากหลายสาเหตุ ส่งผลต่อคุณภาพชีวิตของประชาชน จึงมีความจำเป็นต้องพัฒนาปฏิรูประบบการบริหารจัดการที่มีประสิทธิภาพอันจะนำไปสู่การมีอากาศที่สะอาด",313,44042,NORMAL_BILL,29/2563,"[""สิ่งแวดล้อม"",""สุขภาพ""]",REJECT,,,6f5d554f-71f1-400a-b6c1-135561e5259f,26/9/2025 15:19,24/10/2025 18:48,สภาผู้แทนราษฎร ชุดที่ 25,94e56838-a910-4359-984d-55c0ee7a826e,นาย ศุภชัย ใจสมุทร,94e56838-a910-4359-984d-55c0ee7a826e,ภูมิใจไทย,นายกรัฐมนตรี ครม. คณะที่ 62 (ประยุทธ์ จันทร์โอชา),พรรคฝ่ายรัฐบาล,พรรคการเมือง
