motion_id,title_motion,text_motion,lis_id,proposal_date,classification,acceptance_number,categories,status,billenforce_id,billmerge__id,billreject_id,created_at,updated_at,organizations_bill,propser ID,proposer,voters_id,voter_party,Table - data_cleansing.parliament,Table - data_cleansing.party_side,Table - data_cleansing.creators_type
bc786e5d-496b-4f9c-ba9e-93ec67111bfb,ร่างพระราชบัญญัติส่งเสริมและคุ้มครองกลุ่มชาติพันธุ์ พ.ศ. ....,โดยที่มาตรา 70 ของรัฐธรรมนูญแห่งราชอาณาจักรไทยได้บัญญัติให้รัฐพึงส่งเสริมและให้ความคุ้มครองชาวไทยกลุ่มชาติพันธุ์ต่าง ๆ ให้มีสิทธิดำรงชีวิตในสังคมตามวัฒนธรรม ประเพณี และวิถีชีวิตดั้งเดิมตามความสมัครใจได้อย่างสงบสุข ไม่ถูกรบกวน ซึ่งประเทศไทยมีกลุ่มชาติพันธุ์ที่แตกต่างและหลากหลาย แต่ละกลุ่มล้วนมีวิถีชีวิต ภาษา ภูมิปัญญา และวัฒนธรรมที่เป็นเอกลักษณ์ของตนเองมาช้านาน ประเทศไทยได้มีการให้สัตยาบันต่อพันธกรณีระหว่างประเทศเกี่ยวกับการส่งเสริมและอนุรักษ์วิถีชีวิตของกลุ่มชาติพันธุ์หลายฉบับ ซึ่งปัจจุบันไม่มีกฎหมายส่งเสริมและคุ้มครองกลุ่มชาติพันธุ์โดยตรง ส่งผลให้กลุ่มชาติพันธุ์ต้องเผชิญปัญหาด้านต่าง ๆ โดยเฉพาะการขาดสิทธิทางวัฒนธรรม ขาดสิทธิทางทรัพยากร และอคติทางสังคมต่อกลุ่มชาติพันธุ์ ดังนั้นเพื่อให้ภาครัฐมีบทบาทและอำนาจตามกฎหมายอย่างถูกต้องสอดคล้องกับสภาพสังคมวัฒนธรรมของประเทศไทยที่มีความหลากหลายทางเชื้อชาติและวัฒนธรรม และเพื่อให้กลุ่มชาติพันธุ์ได้เข้ามามีส่วนร่วมในการดูแลรักษาและสืบทอดวัฒนธรรมอันดีงามตลอดจนการดูแลและสามารถใช้ประโยชน์จากทรัพยากรที่มีอยู่ตามธรรมชาติในท้องถิ่นของตนได้อย่างยั่งยืนถูกต้องตามกฎหมายโดยไม่ถูกดูถูก เหยียดหยาม หรือการกีดกันจากกลุ่มบุคคลภายนอกที่มีความแตกต่างทางเชื้อชาติและวัฒนธรรม และรัฐพึงส่งเสริมและให้ความคุ้มครองชาวไทยกลุ่มชาติพันธุ์ ให้มีความสามารถในการพึ่งพาตนเองมีศักดิ์ศรีความเป็นมนุษย์ และมีโอกาสในการเข้ามามีส่วนร่วมในการพัฒนาประเทศอย่างแท้จริง การมีกฎหมายเพื่อส่งเสริมและคุ้มครองสิทธิของกลุ่มชาติพันธุ์จึงสอดคล้องกับทั้งความเป็นจริงของสังคมวัฒนธรรมไทยและรัฐธรรมนูญ จึงจำเป็นต้องตราพระราชบัญญัตินี้,126,44378,NORMAL_BILL,54/2564,"[""สิทธิมนุษยชน"",""สวัสดิการสังคม""]",REJECT,,,465eb20b-a7a8-452d-931f-043504a38d67,26/9/2025 15:19,24/10/2025 18:47,สภาผู้แทนราษฎร ชุดที่ 25,d456e242-dc03-42cf-b512-00f9a275537b,นาย ณัฐพล สืบศักดิ์วงศ์,d456e242-dc03-42cf-b512-00f9a275537b,ก้าวไกล,นายกรัฐมนตรี ครม. คณะที่ 62 (ประยุทธ์ จันทร์โอชา),พรรคฝ่ายค้าน,พรรคการเมือง
1f3868ec-17fd-4375-8a3d-1065adea62d9,ร่างพระราชบัญญัติพืชควบคุมเพื่อประโยชน์ทางการแพทย์ พ.ศ. ....,หลักการ ให้มีกฎหมายว่าด้วยพืชควบคุมเพื่อประโยชน์ทางการแพทย์ เหตุผล เนื่องด้วยยาเสพติดประเภท 5 ตามกฎหมายว่าด้วยยาเสพติดให้โทษ เป็นพืชที่ให้สารเสพติดซึ่งอาจก่อให้เกิดปัญหาทางสุขภาพ หรือปัญหาทางสังคมได้หากใช้ไม่ถูกต้องเหมาะสม แต่สารเสพติดที่ได้จากต้นพืชนั้นก็ยังมีประโยชน์ในทางการแพทย์ และต้พืชส่วนอื่นและสารชนิดอื่นนั้น ยังมีประโยชน์สามารถใช้เป็นอาหาร เครื่องสำอาง ยารักษาโรค หรืออื่น ๆ ที่สร้างรายได้ให้กับประชาชนได้ จึงจำเป็นต้องตราพระราชบัญญัตินี้,336,44162,NORMAL_BILL,54/2563,"[""สุขภาพ"",""การเกษตร""]",PENDING,,,,26/9/2025 15:19,24/10/2025 18:47,สภาผู้แทนราษฎร ชุดที่ 25,6afb11cf-1731-44c5-ab93-a16770a96879,นาย อนุรักษ์ ตั้งปณิธานนท์,6afb11cf-1731-44c5-ab93-a16770a96879,เพื่อไทย,นายกรัฐมนตรี ครม. คณะที่ 62 (ประยุทธ์ จันทร์โอชา),พรรคฝ่ายค้าน,พรรคการเมือง
926126bf-cf3e-40d7-84db-813b0d13ac80,ร่างพระราชบัญญัติยกเลิกคำสั่งหัวหน้าคณะรักษาความสงบแห่งชาติ ที่ ๘/๒๕๖๐ เรื่อง การขับเคลื่อนการปฏิรูปการบริหารงานส่วนบุคคลท้องถิ่น ลงวันที่ ๒๑ กุมภาพันธ์ พุทธศักราช ๒๕๖๐ พ.ศ. ....,ยกเลิกคำสั่งหัวหน้าคณะรักษาความสงบแห่งชาติ ที่ ๘/๒๕๖๐ เรื่อง การขับเคลื่อนการปฏิรูปการบริหารงานส่วนบุคคลท้องถิ่น ลงวันที่ ๒๑ กุมภาพันธ์ พุทธศักราช ๒๕๖๐,267,44721,NORMAL_BILL,53/2565,"[""บริหารราชการ"",""สิทธิมนุษยชน""]",REJECT,,,2aeac5fe-aede-40e0-a8e7-c062438c02a8,26/9/2025 15:19,24/10/2025 18:47,สภาผู้แทนราษฎร ชุดที่ 25,a61a7e43-0fe7-40ed-a909-88c45be0d8b2,นาย ชัยชนะ เดชเดโช,a61a7e43-0fe7-40ed-a909-88c45be0d8b2,ประชาธิปัตย์,นายกรัฐมนตรี ครม. คณะที่ 62 (ประยุทธ์ จันทร์โอชา),พรรคฝ่ายรัฐบาล,พรรคการเมือง
e7f9a632-ab79-4648-8252-7d93ab566b9c,ร่างพระราชบัญญัติสภาครูและบุคลากรทางการศึกษา (ฉบับที่ ..) พ.ศ. ....,แก้ไขเพิ่มเติมพระราชบัญญัติสภาครูและบุคลากรทางการศึกษา พ.ศ. ๒๕๔๖ โดยที่ครูเป็นอาชีพที่รับผิดชอบต่อการสร้างและพัฒนาทรัพยากรมนุษย์ บุคลากรทางการศึกษาจึงมีบทบามสำคัญอย่างมากต่อการศึกษาของชาติ ขณะเดียวกันจะต้องมีการส่งเสริมสวัสดิการและสวัสดิภาพ เพื่อสร้างความมั่นคงให้แก่ผู้ประกอบวิชาชีพและผู้ปฏิบัติงานด้านการศึกษา จึงควรกำหนดให้บุคลากรดังกล่าวเป็นวิชาชีพทางการศึกษาทั้งหมด รวมทั้งกำหนดให้มีใบอนุญาตประกอบวิชาชีพครูหรืออาชีพทางการศึกษาเพิ่มขึ้น ได้แก่ ครู ผู้บริหารสถานศึกษา ศึกษานิเทศก์ นักพัฒนาการศึกษา และผู้บริหารการศึกษาในระดับส่วนราชการ นอกจากนี้ ยังควรจัดให้มีการรวมตัวเป็นองค์กรวิชาชีพในรูปของสภาวิชาชีพ เรียกว่า คุรุสภา เป็นองค์หลักหรือองค์กรกลางที่จะทำหน้าที่ในการควบคุม กำกับดูแล สนับสนุน ส่งเสริมด้านต่าง ๆ เกี่ยวกับวิชาชีพครูหรือวิชาชีพทางการศึกษาให้เป็นไปอย่างมีประสิทธิภาพ อีกทั้งกำหนดให้มีองค์กรที่ดำเนินการส่งเสริมสวัสดิการและสวัสดิภาพครูเพื่อความก้าวหน้ามั่นคงในวิชาชีพ อันจะส่งผลต่อการพัฒนาวิชาชีพและสนับสนุนภารกิจของกระทรวงศึกษาธิารให้มีศักยภาพมากยิ่งขึ้น สามารถผลิตและพัฒนาทรัพยากรมนุษย์ให้มีประสิทธิภาพ จึงจำเป็นต้องตราพระราชบัญญัตินี้,121,44365,NORMAL_BILL,53/2564,"[""การศึกษา""]",REJECT,,,bd42ba8d-485a-4f06-9d61-90d1328f299f,26/9/2025 15:19,24/10/2025 18:47,สภาผู้แทนราษฎร ชุดที่ 25,acb06250-40f7-45a4-a340-cccb64030170,รองศาสตราจารย์ ดร. สุรวาท ทองบุ,acb06250-40f7-45a4-a340-cccb64030170,ประชาชน,นายกรัฐมนตรี ครม. คณะที่ 62 (ประยุทธ์ จันทร์โอชา),พรรคฝ่ายค้าน,พรรคการเมือง
eda6a454-9394-4683-b976-9f144fec7298,ร่างพระราชบัญญัติว่าด้วยการออกเสียงประชามติ พ.ศ. ....,ให้มีกฎหมายว่าด้วยการออกเสียงประชามติ เพื่อให้สอดคล้องกับบทบัญญัติของรัฐธรรมนูญ,88,44153,NORMAL_BILL,53/2563,"[""บริหารราชการ"",""สิทธิมนุษยชน""]",REJECT,,,2b2612ef-e6de-41e1-a67a-a4d713e3ff22,26/9/2025 15:19,24/10/2025 18:47,สภาผู้แทนราษฎร ชุดที่ 25,,  ,,เพื่อไทย,นายกรัฐมนตรี ครม. คณะที่ 62 (ประยุทธ์ จันทร์โอชา),,
9bfb5d3b-c399-4742-9897-b7354b652fac,ร่างพระราชบัญญัติประกันชีวิต (ฉบับที่ ..) พ.ศ. ....,เป็นการแก้ไขเพิ่มเติมพระราชบัญญัติประกันชีวิต พ.ศ. ๒๕๓๕ ในส่วนที่เกี่ยวกับการกำกับดูแล บริษัทประกันชีวิต ยังไม่มีบทบัญญัติที่เกี่ยวข้องกับการเสริมสร้างเสถียรภาพและความมั่นคง ของบริษัทตามหลักมาตรฐานการกำกับดูแลสากล ประกอบกับบทบัญญัติที่มีอยู่ยังไม่ สอดคล้องกับการประกอบธุรกิจประกันชีวิต รวมถึงมาตรการในการแก้ไขปัญหาที่เกิดขึ้นกับริษัท ประกันชีวิต เพื่อให้การกำกับดูแลบริษัทประกันชีวิตเป็นไปอย่างมีประสิทธิภาพ รวมทั้งแก้ไข กระบวนการในการควบคุมบริษัทให้มีความชัดเจน ตลอดจนแก้ไขเพิ่มเติมเกี่ยวกับผู้ที่มีความ เกี่ยวข้องกับธุรกิจประกันภัยทั้งผู้สอบบัญชี และนักคณิตศาสตร์ประกันภัย,278,44874,NORMAL_BILL,52/2565,"[""เศรษฐกิจ"",""สวัสดิการสังคม""]",REJECT,,,58549f81-1256-4c78-9564-c1b2b1f25189,26/9/2025 15:19,24/10/2025 18:47,สภาผู้แทนราษฎร ชุดที่ 25,d45582fa-6595-4aec-ba71-8cbc3a37013d,นาย ณัฐพงษ์ เรืองปัญญาวุฒิ,d45582fa-6595-4aec-ba71-8cbc3a37013d,ประชาชน,นายกรัฐมนตรี ครม. คณะที่ 62 (ประยุทธ์ จันทร์โอชา),พรรคฝ่ายค้าน,พรรคการเมือง
32ace7c9-1797-41e1-97da-466ef3af356b,พระราชบัญญัติการเลือกตั้งสมาชิกสภาท้องถิ่นหรือผู้บริหารท้องถิ่น (ฉบับที่ ..) พ.ศ. ....,"แก้ไขเพิ่มเติมพระราชบัญญัติการเลือกตั้งสมาชิกสภาท้องถิ่นหรือผู้บริหารท้องถิ่น โดยให้พรรคการเมือง สมาชิกสภาผู้แทนราษฎร สมาชิกวุฒิสภา สมาชิกสภาท้องถิ่น หรือผู้บริหารท้องถิ่น สามารถ
หาเสียงหรือสนับสนุนการหาเสียงเลือกตั้งให้ผู้สมัครรับเลือกตั้งสมาชิกสภาท้องถิ่นหรือผู้บริหารท้องถิ่นได้ (แก้ไขเพิ่มเติมมาตรา ๓๔)",252,44713,NORMAL_BILL,52/2565,"[""บริหารราชการ"",""สิทธิมนุษยชน""]",ENFORCE,eb913b38-cc87-4f0a-b3e3-ff03b699f01f,,,26/9/2025 15:19,24/10/2025 18:47,สภาผู้แทนราษฎร ชุดที่ 25,6daa9e08-c04d-41c4-bed5-5f7053607deb,นาย ประเสริฐพงษ์ ศรนุวัตร์,6daa9e08-c04d-41c4-bed5-5f7053607deb,ประชาชน,นายกรัฐมนตรี ครม. คณะที่ 62 (ประยุทธ์ จันทร์โอชา),พรรคฝ่ายค้าน,พรรคการเมือง
2d57505c-59cd-4116-b2ab-4bb995135e3d,ร่างพระราชบัญญัติปาล์มน้ำมันและผลิตภัณฑ์จากปาล์มน้ำมัน พ.ศ. ....,ให้มีกฎหมายว่าด้วยปาล์มน้ำมันและผลิตภัณฑ์จากปาล์มน้ำมัน เนื่องจากปาล์มน้ำมันเป็นพืชที่มีความสำคัญด้านความมั่นคงทางอาหารและพลังงานของประเทศและเพื่อเป็นการพัฒนาการเกษตรและอุตสาหกรรมปาล์มน้ำมันและผลิตภัณฑ์จากปาล์มน้ำมันของประเทศ ให้มีศักยภาพ มาตรฐาน และสามารถแข่งขันได้ภายใต้ระบบการค้าเสรี รวมทั้งบูรณาการการศึกษา การวิจัยและพัฒนา ช่วยเหลือสนับสนุนและสร้างความเข้มแข็งให้แก่การเกษตรและอุตสาหกรรมปาล์มน้ำมันและผลิตภัณฑ์จากปาล์มน้ำมันอย่างเป็นระบบและมีประสิทธิภาพ จำเป็นต้องมีคณะกรรมการนโยบายปาล์มน้ำมันแห่งชาติ เพื่อเป็นผู้รับผิดชอบจัดทำนโยบายและแผนการบริหารจัดการการเกษตรและอุตสาหกรรมปาล์มน้ำมันและผลิตภัณฑ์จากปาล์มน้ำมัน และติดตามการดำเนินการตามนโยบายและแผนดังกล่าว รวมทั้งเห็นควรจัดตั้งกองทุนปาล์มน้ำมันและผลิตภัณฑ์ปาล์มน้ำมัน เพื่อสนับสนุนการเกษตรและอุตสาหกรรมปาล์มน้ำมันและผลิตภัณฑ์จากปาล์มน้ำมัน และการรวมกลุ่มของเกษตรกรชาวสวนปาล์มน้ำมัน และให้มีการกำกับกิจการรับซื้อผลปาล์มน้ำมันเท่าที่จำเป็น,276,44868,NORMAL_BILL,52/2565,"[""การเกษตร""]",REJECT,,,53a7ad30-0e35-4c6a-9d61-5528250f3f16,26/9/2025 15:19,24/10/2025 18:47,สภาผู้แทนราษฎร ชุดที่ 25,52a6810c-fdca-4e97-93ec-3ba2be660578,นางสาว พิมพ์รพี พันธุ์วิชาติกุล,52a6810c-fdca-4e97-93ec-3ba2be660578,ประชาธิปัตย์,นายกรัฐมนตรี ครม. คณะที่ 62 (ประยุทธ์ จันทร์โอชา),พรรคฝ่ายรัฐบาล,พรรคการเมือง
1f473263-fb1c-4cf0-b928-9490d1c99911,ร่างพระราชบัญญัติระเบียบข้าราชการครู พ.ศ. ....,ปรับปรุงกฎหมายว่าด้วยระเบียบข้าราชการครู พ.ศ. ....,125,44365,NORMAL_BILL,52/2564,"[""บริหารราชการ"",""การศึกษา""]",REJECT,,,ed19e756-2a91-49a2-9e86-336bb3f575ff,26/9/2025 15:19,24/10/2025 18:47,สภาผู้แทนราษฎร ชุดที่ 25,acb06250-40f7-45a4-a340-cccb64030170,รองศาสตราจารย์ ดร. สุรวาท ทองบุ,acb06250-40f7-45a4-a340-cccb64030170,ประชาชน,นายกรัฐมนตรี ครม. คณะที่ 62 (ประยุทธ์ จันทร์โอชา),พรรคฝ่ายค้าน,พรรคการเมือง
67d36217-96ab-4bd1-82b2-cb778dcfced1,ร่างพระราชบัญญัติกัญชา กัญชง พ.ศ. ....,"ให้มีกฎหมายว่าด้วยกัญชา กัญชง โดยที่ประมวลกฎหมายยาเสพติดไม่ได้กำหนดให้กัญชา กัญชง
เป็นยาเสพติด จึงเปิดโอกาสให้ประชาชนเข้าถึงการปลูก การผลิต การใช้กัญชา กัญชง เช่นเดียวกับพืชโดยทั่วไป
ซึ่งกฎหมายฉบับนี้ มีเจตนารมณ์ในการรักษาสิทธิพื้นฐานของประชาชนในการเข้าถึงการปลูก การผลิต การใช้ตามวิถีของชุมชน ได้อย่างมีเสรีภาพ โดยมิถูกมาตรการใดกีดกันจากหน่วยงานของรัฐ ให้มีการกระจายประโยชน์ทางเศรษฐกิจ
ตลอดจนมาตรการควบคุมคุณภาพผลิตภัณฑ์เพื่อการคุ้มครองผู้บริโภคให้มีการใช้กัญชา กัญชง อย่างเหมาะสม",254,44713,NORMAL_BILL,52.1/2565,"[""สุขภาพ"",""เศรษฐกิจ""]",PENDING,,,,26/9/2025 15:19,24/10/2025 18:47,สภาผู้แทนราษฎร ชุดที่ 25,8f3d13ad-d242-4195-b6bb-7388dd3af44e,นาย เท่าพิภพ ลิ้มจิตรกร,8f3d13ad-d242-4195-b6bb-7388dd3af44e,ประชาชน,นายกรัฐมนตรี ครม. คณะที่ 62 (ประยุทธ์ จันทร์โอชา),พรรคฝ่ายค้าน,พรรคการเมือง
