motion_id,title_motion,text_motion,lis_id,proposal_date,classification,acceptance_number,categories,status,billenforce_id,billmerge__id,billreject_id,created_at,updated_at,organizations_bill,propser ID,proposer,voters_id,voter_party,Table - data_cleansing.parliament,Table - data_cleansing.party_side,Table - data_cleansing.creators_type
ebf25aa3-8cbf-48f5-82a5-dbb73a506b82,ร่างพระราชบัญญัติองค์กรจัดสรรคลื่นความถี่และกำกับการประกอบกิจการวิทยุกระจายเสียง วิทยุโทรทัศน์ และกิจการโทรคมนาคม (ฉบับที่ ..) พ.ศ. ....,"แก้ไขเพิ่มเติมพระราชบัญญัติองค์กรจัดสรรคลื่นความถี่และกำกับการประกอบกิจการวิทยุกระจายเสียง วิทยุโทรทัศน์ และกิจการโทรคมนาคม พ.ศ. ๒๕๕๓ 
โดยกำหนดห้ามไม่ให้ กสทช. นำคลื่นความถี่วิทยุภาคประชาชนและคลื่นความถี่วิทยุที่มีกำลังส่งไม่เกินหนึ่งกิโลวัตต์ออกประมูล
เนื่องจากเป็นการประกอบกิจการขนาดเล็กของชุมชน หากมีการนำไปประมูลจะทำให้ผู้ประกอบกิจการรายใหญ่เข้าครอบงำวิทยุภาคประชาชนและวิทยุกิจการบริการชุมชนได้ รวมทั้งกำหนดให้วิธีการหารายได้ของผู้ประกอบกิจการบริการชุมชนเป็นไปตามหลักเกณฑ์ที่คณะกรรมการตามกฎหมายว่าด้วยการประกอบกิจการกระจายเสียงและกิจการโทรทัศน์ประกาศกำหนด เพื่อส่งเสริมให้สถานีวิทยุชุมชนมีรายได้เพียงพอในการประกอบกิจการ            ",587,45651,NORMAL_BILL,57/2567,"[""เทคโนโลยี""]",PENDING,,,,29/9/2025 23:40,24/10/2025 18:50,สภาผู้แทนราษฎร ชุดที่ 26,ff283208-933c-4418-92a9-85f73f27a532,นาย เอกราช อุดมอำนวย,ff283208-933c-4418-92a9-85f73f27a532,ประชาชน,นายกรัฐมนตรี ครม. คณะที่ 64 (แพทองธาร ชินวัตร),พรรคฝ่ายค้าน,พรรคการเมือง
f4a99aaf-e1ba-42e1-aed2-01d023857a6a,ร่างพระราชบัญญัติสร้างเสริมสังคมสันติสุข พ.ศ. ....,"กำหนดให้บรรดาการกระทำใด ๆ ของบุคคลที่เกี่ยวเนื่องกับการชุมนุมทางการเมือง หรือการแสดงออก
ทางการเมือง หรือบุคคลที่ไม่ได้เข้าร่วมการชุมนุมทางการเมืองแต่การกระทำนั้นมีมูลเหตุเกี่ยวข้อง
หรือเกี่ยวเนื่องกับความขัดแย้งทางการเมือง ตั้งแต่วันที่ ๑๙ กันยายน พ.ศ. ๒๕๔๙ ถึงวันที่ ๓๐ พฤศจิกายน ๒๕๖๕ ไม่เป็นความผิดทั้งทางอาญาและทางแพ่ง และให้ผู้กระทำการนั้นพ้นจากการเป็นผู้กระทำความผิดและความรับผิดโดยสิ้นเชิง แต่ไม่รวมถึงการกระทำความผิดฐานทุจริตหรือประพฤติมิชอบ การกระทำความผิดตามประมวลกฎหมายอาญา มาตรา ๑๑๒ หรือการกระทำที่เป็นการละเมิดสิทธิมนุษยชนอย่างร้ายแรง กำหนดให้ผู้กระทำการตามมาตรา ๓ วรรคหนึ่ง ที่ยังมิได้ถูกฟ้องต่อศาล
หรืออยู่ในระหว่างการสอบสวน ให้พนักงานสอบสวนผู้ซึ่งมีอำนาจสอบสวนหรือพนักงานอัยการระงับการสอบสวนหรือ
การฟ้องร้อง กำหนดให้การนิรโทษกรรมตามพระราชบัญญัตินี้ไม่เป็น
การตัดสิทธิของบุคคลซึ่งไม่ใช่องค์กรหรือหน่วยงานของรัฐในการเรียกร้องค่าเสียหายในทางแพ่งจากการกระทำของบุคคลใด
ซึ่งพ้นจากความรับผิดตามพระราชบัญญัตินี้ และทำให้ตนต้องได้รับความเสียหาย และให้มีคณะกรรมการกลั่นกรองคดีที่จะได้รับการนิรโทษกรรม แต่งตั้งโดยรัฐมนตรีว่าการกระทรวงยุติธรรม และให้มีบัญชีแนบท้ายพระราชบัญญัติ",433,45280,NORMAL_BILL,57/2566,"[""สวัสดิการสังคม"",""ยุติธรรม""]",PENDING,,,,29/9/2025 23:40,24/10/2025 18:50,สภาผู้แทนราษฎร ชุดที่ 26,95de0377-402b-40f9-8427-8fa5a116f8ef,นาย ปรีดา บุญเพลิง,95de0377-402b-40f9-8427-8fa5a116f8ef,กล้าธรรม,นายกรัฐมนตรี ครม. คณะที่ 62 (ประยุทธ์ จันทร์โอชา),พรรคฝ่ายค้าน,พรรคการเมือง
22b3a2d6-7c6b-4d96-bbb9-09364769bd31,ร่างพระราชบัญญัติแก้ไขเพิ่มเติมประมวลกฎหมายอาญา (ฉบับที่ ..) พ.ศ. ....,,525,45496,NORMAL_BILL,55/2567,,PENDING,,,,29/9/2025 23:40,24/10/2025 18:50,สภาผู้แทนราษฎร ชุดที่ 26,5c1f42cb-f3bd-4e1e-b53a-879feaa15439,นาย สหัสวัต คุ้มคง,5c1f42cb-f3bd-4e1e-b53a-879feaa15439,ประชาชน,นายกรัฐมนตรี ครม. คณะที่ 63 (เศรษฐา ทวีสิน),พรรคฝ่ายค้าน,พรรคการเมือง
35254dda-1e8b-440e-a007-6d48c3b021c1,ร่างพระราชบัญญัติบริหารจัดการภาวะโลกร้อนและการเปลี่ยนแปลงสภาพภูมิอากาศ พ.ศ. ....,,616,45645,NORMAL_BILL,55/2567,,PENDING,,,,29/9/2025 23:40,24/10/2025 18:50,สภาผู้แทนราษฎร ชุดที่ 26,aa14acb1-a0b5-4e62-8a64-007187d10037,นาย ร่มธรรม ขำนุรักษ์,aa14acb1-a0b5-4e62-8a64-007187d10037,ประชาธิปัตย์,นายกรัฐมนตรี ครม. คณะที่ 64 (แพทองธาร ชินวัตร),พรรคฝ่ายรัฐบาล,พรรคการเมือง
abaad703-a2c9-4988-bec2-6cd06ec033a0,ร่างพระราชบัญญัติสงวนและคุ้มครองสัตว์ป่า (ฉบับที่ ..) พ.ศ. ....,"แก้ไขเพิ่มเติมพระราชบัญญัติสงวนและคุ้มครองสัตว์ป่า พ.ศ. ๒๕๖๒ ดังต่อไปนี้
(๑) แก้ไขเพิ่มเติมหลักเกณฑ์ในการแต่งตั้งกรรมการผู้ทรงคุณวุฒิของคณะกรรมการสงวนและคุ้มครองสัตว์ป่า (แก้ไขเพิ่มเติมมาตรา ๓๙ วรรคหนึ่ง)
(๒) แก้ไขเพิ่มเติมหลักเกณฑ์ในการพิจารณากำหนดเขตรักษาพันธุ์สัตว์ป่าและเขตห้ามล่าสัตว์ป่า (แก้ไขเพิ่มเติมมาตรา ๔๘ และมาตรา ๖๒ วรรคหนึ่ง)
(๓) แก้ไขเพิ่มเติมหลักเกณฑ์และวิธีการในการปรับปรุง ซ่อมแซม หรือบำรุงรักษาโครงสร้างสาธารณูปโภคพื้นฐานขององค์กรปกครองส่วนท้องถิ่นภายในเขตรักษาพันธุ์สัตว์ป่าและเขตห้ามล่าสัตว์ป่า (แก้ไขเพิ่มเติมมาตรา ๕๕ และมาตรา ๖๗)
(๔) แก้ไขเพิ่มเติมหลักเกณฑ์และวิธีการในการพิจารณาศึกษาและจัดทำโครงการใช้ประโยชน์จากทรัพยากรธรรมชาติที่เกิดทดแทนได้ตามหลักวิชาการ วัฒนธรรม และวิถีชุมชนภายในเขตรักษาพันธุ์สัตว์ป่า (แก้ไขเพิ่มเติมมาตรา ๕๗ วรรคหนึ่ง)
(๕) แก้ไขเพิ่มเติมบทเฉพาะกาลเกี่ยวกับการรับรองและคุ้มครองสิทธิของผู้ซึ่งได้ครอบครองทำประโยชน์อยู่ก่อนกำหนดเป็นเขตรักษาพันธุ์สัตว์ป่าหรือเขตห้ามล่าสัตว์ป่า หรือการช่วยเหลือผู้ซึ่งไม่มีที่ดินทำกินและได้อยู่อาศัยหรือทำกินภายในเขตรักษาพันธุ์สัตว์ป่าหรือเขตห้ามล่าสัตว์ป่า (แก้ไขเพิ่มเติมมาตรา ๑๒๑)            ",584,45610,NORMAL_BILL,54/2567,"[""ส่ิงแวดล้อม""]",PENDING,,,,29/9/2025 23:40,24/10/2025 18:50,สภาผู้แทนราษฎร ชุดที่ 26,6028b1c7-da47-4f7a-9cba-7b256bf5264a,นาย เลาฟั้ง บัณฑิตเทอดสกุล,6028b1c7-da47-4f7a-9cba-7b256bf5264a,ประชาชน,นายกรัฐมนตรี ครม. คณะที่ 64 (แพทองธาร ชินวัตร),พรรคฝ่ายค้าน,พรรคการเมือง
42da0682-704d-4155-8a07-5210f450a59b,ร่างพระราชบัญญัติป้องกันการดำเนินคดีเพื่อปิดกั้นการมีส่วนร่วมเพื่อประโยชน์สาธารณะ พ.ศ. ...,,661,45910,NORMAL_BILL,53/2568,,REJECT,,,df2d66d9-88b1-4db1-bc06-c01d9492d87c,29/9/2025 23:40,24/10/2025 18:50,สภาผู้แทนราษฎร ชุดที่ 26,afb4633a-b478-4dac-80c7-000e71f900e8,นางสาว ชลธิชา แจ้งเร็ว,afb4633a-b478-4dac-80c7-000e71f900e8,ประชาชน,นายกรัฐมนตรี ครม. คณะที่ 65 (อนุทิน ชาญวีรกูล),,
5d674b93-1001-4ee5-b08a-e383cf3c0dd2,ร่างพระราชบัญญัติป่าสงวนแห่งชาติ (ฉบับที่ ..) พ.ศ. ....,"แก้ไขเพิ่มเติมพระราชบัญญัติป่าสงวนแห่งชาติ พ.ศ. ๒๕๐๗ ดังต่อไปนี้
(๑) เพิ่มหลักเกณฑ์ในการพิจารณากำหนดเป็นเขตป่าสงวนแห่งชาติ (เพิ่มมาตรา ๖ วรรคสาม)
(๒) แก้ไขเพิ่มเติมองค์ประกอบของคณะกรรมการควบคุมและรักษาป่าสงวนแห่งชาติประจำจังหวัด และเพิ่มอำนาจหน้าที่ของคณะกรรมการควบคุมและรักษาป่าสงวนแห่งชาติประจำจังหวัด
ในการพิจารณาให้ความเห็นชอบคำขอใช้พื้นที่ป่าสงวนแห่งชาติของส่วนราชการและหน่วยงานของรัฐ 
(แก้ไขเพิ่มเติมมาตรา ๑๐ และเพิ่มมาตรา ๑๑ (๗))
(๓) แก้ไขเพิ่มเติมการยื่นคำร้องและการพิสูจน์สิทธิของผู้ซึ่งได้อยู่อาศัยหรือทำประโยชน์ในที่ดินในเขตป่าสงวนแห่งชาติ รวมทั้งการยื่นคำขออนุญาตอยู่อาศัยหรือทำประโยชน์ในที่ดินในเขตป่าสงวนแห่งชาติซึ่งอยู่ในความดูแลขององค์กรปกครองส่วนท้องถิ่น (แก้ไขเพิ่มเติมมาตรา ๑๒ และมาตรา ๑๓)
(๔) แก้ไขเพิ่มเติมหลักเกณฑ์การขออนุญาตใช้พื้นที่ป่าสงวนแห่งชาติของส่วนราชการและหน่วยงานของรัฐ (แก้ไขเพิ่มเติมมาตรา ๑๓/๑)            ",583,45610,NORMAL_BILL,53/2567,"[""สิ่งแวดล้อม""]",PENDING,,,,29/9/2025 23:40,24/10/2025 18:50,สภาผู้แทนราษฎร ชุดที่ 26,6028b1c7-da47-4f7a-9cba-7b256bf5264a,นาย เลาฟั้ง บัณฑิตเทอดสกุล,6028b1c7-da47-4f7a-9cba-7b256bf5264a,ประชาชน,นายกรัฐมนตรี ครม. คณะที่ 64 (แพทองธาร ชินวัตร),พรรคฝ่ายค้าน,พรรคการเมือง
969e45e9-0b42-4478-8fba-daf48240cdf8,ร่างพระราชบัญญัติระเบียบบริหารราชการฝ่ายรัฐสภา (ฉบับที่ ..) พ.ศ. ....,"ร่างพระราชบัญญัติฉบับนี้เป็นการแก้ไขเพิ่มเติมพระราชบัญญัติระเบียบบริหารราชการ
ฝ่ายรัฐสภา พ.ศ. ๒๕๕๔ โดยที่การบริหารจัดการงบประมาณรายจ่ายของส่วนราชการสังกัดรัฐสภาได้รับ
การจัดสรรงบประมาณเป็นเงินอุดหนุน แต่หากไม่สามารถเบิกจ่ายได้ทันภายในปีงบประมาณหรือมีเงินเหลือจ่ายเมื่อสิ้นปีงบประมาณ
ส่วนราชการสังกัดรัฐสภาต้องดำเนินการขอกันเงินไว้เบิกจ่ายต่อกระทรวงการคลังหรือ
ส่งเงินคืนคลัง ทำให้การบริหารจัดการงบประมาณของส่วนราชการสังกัดรัฐสภาไม่มีความคล่องตัว
และเพื่อให้การดำเนินงานของส่วนราชการสังกัดรัฐสภามีประสิทธิภาพมากยิ่งขึ้น จึงสมควรกำหนดให้ส่วนราชการสังกัดรัฐสภา
สามารถนำเงินงบประมาณประจำปีเหลือจ่ายมาใช้ในปีงบประมาณถัดไป จึงมีการแก้ไขเพิ่มเติมและ
มีรายละเอียด ดังนี้
๑. ให้เพิ่มมาตรา ๑๓/๑ โดยกำหนดให้รายได้และทรัพย์สินในการดำเนินกิจการของส่วนราชการสังกัดรัฐสภา ประกอบด้วย (ร่างมาตรา ๓)
(๑) เงินอุดหนุนที่ได้รับตามมาตรา ๑๓ 
(๒) รายได้จากค่าธรรมเนียมหรือทรัพย์สินของส่วนราชการสังกัดรัฐสภา
(๓) ทรัพย์สินที่มีผู้อุทิศให้แก่ส่วนราชการสังกัดรัฐสภา
(๔) ดอกผลหรือประโยชน์ของเงินหรือทรัพย์สินของส่วนราชการสังกัดรัฐสภา
(๕) เงินที่ได้รับชำระตามอำนาจหน้าที่หรือสัญญา
(๖) รายได้อื่นตามที่กฎหมายกำหนด
๒. ให้เพิ่มมาตรา ๑๓/๒ โดยกำหนดให้รายได้ของส่วนราชการสังกัดรัฐสภาไม่เป็นรายได้ที่ต้องนำส่งคลังตามกฎหมายว่าด้วยเงินคงคลัง
กฎหมายว่าด้วยวิธีการงบประมาณ หรือกฎหมายอื่น (ร่างมาตรา ๓)            ",549,45491,NORMAL_BILL,53/2567,"[""บริหารราชการ""]",REJECT,,,65bbcd32-6fa9-4854-bc9b-a5973bbbc50d,29/9/2025 23:40,24/10/2025 18:50,สภาผู้แทนราษฎร ชุดที่ 26,429ef73f-1b1a-47d3-9e5c-e9e1aab71f59,ดร. สฤษฏ์พงษ์ เกี่ยวข้อง,429ef73f-1b1a-47d3-9e5c-e9e1aab71f59,ภูมิใจไทย,นายกรัฐมนตรี ครม. คณะที่ 63 (เศรษฐา ทวีสิน),พรรคฝ่ายรัฐบาล,พรรคการเมือง
